{
  "$schema": "https://json-schema.org/draft/2020-12/schema",
  "$defs": {
    "CircuitDiversity": {
      "properties": {
        "distinct_operators": {
          "type": "boolean"
        },
        "distinct_networks": {
          "type": "boolean"
        },
        "operator_count": {
          "type": "integer"
        },
        "network_count": {
          "type": "integer"
        },
        "note": {
          "type": "string"
        }
      },
      "additionalProperties": false,
      "type": "object",
      "required": [
        "distinct_operators",
        "distinct_networks",
        "operator_count",
        "network_count",
        "note"
      ]
    },
    "EndpointDesc": {
      "oneOf": [
        {
          "properties": {
            "ip_address": {
              "type": "string"
            },
            "port": {
              "type": "integer"
            },
            "protocol": {
              "type": "string"
            },
            "is_stun_discovered": {
              "type": "boolean"
            }
          },
          "additionalProperties": false,
          "type": "object",
          "required": [
            "ip_address",
            "port"
          ]
        },
        {
          "type": "string"
        }
      ]
    },
    "HopInfo": {
      "properties": {
        "hop_index": {
          "type": "integer"
        },
        "node_id": {
          "type": "string"
        },
        "public_key_hex": {
          "type": "string"
        },
        "endpoints": {
          "items": {
            "$ref": "#/$defs/EndpointDesc"
          },
          "type": "array"
        }
      },
      "additionalProperties": false,
      "type": "object",
      "required": [
        "hop_index",
        "node_id",
        "public_key_hex",
        "endpoints"
      ]
    }
  },
  "$comment": "DO NOT EDIT. Generated by 'go run ./cmd/contractgen' from Go struct tags in pkg/control/types.go.",
  "properties": {
    "circuit_id": {
      "type": "integer"
    },
    "hops": {
      "items": {
        "$ref": "#/$defs/HopInfo"
      },
      "type": "array"
    },
    "expiry_timestamp": {
      "type": "integer"
    },
    "diversity": {
      "$ref": "#/$defs/CircuitDiversity"
    }
  },
  "additionalProperties": false,
  "type": "object",
  "required": [
    "circuit_id",
    "hops",
    "expiry_timestamp",
    "diversity"
  ]
}
